{"schema_version":"1.0.0-fixture","fixture":true,"operational":false,"components":[{"name":"Source contracts","status":"COMPLETE","detail":"R2 acquisition and refresh contract accepted."},{"name":"Data-model schemas","status":"COMPLETE","detail":"Expected slots, observations, processing and ledgers designed."},{"name":"Refresh state machine","status":"COMPLETE","detail":"Trigger, active and terminal-state vocabulary designed."},{"name":"Failure-code registry","status":"NOT_STARTED","detail":"R2A Task 2C is the next Cultural design checkpoint."},{"name":"Acquisition","status":"NOT_AUTHORIZED","detail":"No network or Census acquisition is authorized."},{"name":"Promotion and rollback","status":"LOCKED","detail":"No implementation or production authority."}]}